{
  "$schema": "https://json-schema.org/draft/2020-12/schema",
  "$id": "https://bugfix.local/schemas/config.json",
  "title": "bugfix plugin configuration",
  "type": "object",
  "additionalProperties": false,
  "properties": {
    "base_branch": { "type": "string", "minLength": 1 },
    "ticket_adapter": { "type": "string", "enum": ["github", "stub"] },
    "model_hints": {
      "type": "object",
      "additionalProperties": false,
      "description": "Host-agnostic model preferences for sub-agents the loop dispatches. Values are short class names ('haiku', 'sonnet', 'opus') that the host translates to concrete model IDs. The single-session driver (bugfix:run-ticket) inherits the session model for stages themselves; these keys configure sub-agent dispatch within the loop.",
      "properties": {
        "planner":     { "type": "string" },
        "implementer": { "type": "string" },
        "reviewer":    { "type": "string" }
      }
    },
    "retry_budgets": {
      "type": "object",
      "additionalProperties": false,
      "properties": {
        "spec_review":         { "type": "integer", "minimum": 0 },
        "code_quality_review": { "type": "integer", "minimum": 0 },
        "ci":                  { "type": "integer", "minimum": 0 },
        "planning":            { "type": "integer", "minimum": 0 }
      }
    },
    "pr_review": {
      "type": "object",
      "additionalProperties": false,
      "properties": {
        "important_findings_block":          { "type": "boolean" },
        "reviewer_must_run_regression_test": { "type": "boolean" }
      }
    },
    "bot_author_allowlist": {
      "type": "array",
      "items": {
        "type": "string",
        "minLength": 1
      },
      "description": "Additional comment-author logins (besides GitHub's [bot]-suffix and authorAssociation==BOT) that ticket-adapter should treat as bot comments for resume-detection purposes. Used to exempt service accounts (Slack mirrors, release bots, etc.) from triggering spurious resume signals."
    }
  }
}
