{
  "base_branch": "main",
  "ticket_adapter": "github",
  "model_hints": {
    "planner": "opus",
    "implementer": "sonnet",
    "reviewer": "opus"
  },
  "retry_budgets": {
    "spec_review": 2,
    "code_quality_review": 2,
    "ci": 2,
    "planning": 2
  },
  "pr_review": {
    "important_findings_block": false,
    "reviewer_must_run_regression_test": true
  }
}
